{
  "documentHandle": "active-document-handle",
  "revisionToken": "sha256:current-document-revision",
  "sourceAgent": "codex",
  "reviewProfile": "whitepaper-chief-editor-v1",
  "reviewScope": {
    "sectionId": "5.1.3",
    "sectionTitle": "课程体系建设现状",
    "sectionGoal": "说明受访院校课程覆盖情况及课程体系的主要短板"
  },
  "workflow": {
    "stage": "final-previewed",
    "candidateRoundId": "round-5.1.3-002",
    "approvedCandidateIds": ["candidate-5.1.3-01", "candidate-5.1.3-02"]
  },
  "styleBaseline": {
    "profile": "network-security-talent-whitepaper-2022-2024",
    "version": "1"
  },
  "suggestions": [
    {
      "candidateId": "candidate-5.1.3-01",
      "category": "style-alignment",
      "anchorText": "高校课程覆盖已较广",
      "contextAfter": "但实训体系与师资短板突出。",
      "comment": "这里把受访样本的结果外推为高校整体情况，超出了数据边界。建议改为“在本次受访院校中，课程覆盖已较广”。",
      "quality": {
        "issue": "高校课程覆盖的判断没有限定受访样本范围，形成整体性外推。",
        "impact": "课程覆盖结论超出调研证据边界，审稿人无法确认判断适用范围。",
        "action": "soften",
        "actionStatement": "建议改为“在本次受访院校中，课程覆盖已较广”。",
        "purposeCodes": ["evidence-accuracy", "historical-style"],
        "keyTerms": ["课程覆盖", "受访院校"],
        "evidenceIds": [],
        "styleRuleIds": ["STYLE-04"],
        "verification": {
          "fullContextChecked": true,
          "counterEvidenceChecked": true,
          "result": "supported",
          "documentEvidenceExcerpt": "高校课程覆盖已较广",
          "relatedExcerpts": ["但实训体系与师资短板突出。"]
        }
      }
    },
    {
      "candidateId": "candidate-5.1.3-02",
      "category": "duplicate-compression",
      "anchorText": "课程覆盖情况在本节前文已经说明",
      "contextBefore": "本节已完成课程覆盖现状分析。",
      "comment": "这里再次说明课程覆盖情况，但没有增加新的样本、指标或判断，重复拉长了本节。建议删除这句重复说明。",
      "quality": {
        "issue": "课程覆盖情况重复出现，没有推进课程体系短板的分析。",
        "impact": "课程覆盖情况的重复说明增加审稿时间，并削弱课程体系短板这一主判断。",
        "action": "delete",
        "actionStatement": "建议删除这句重复说明。",
        "purposeCodes": ["compression", "chapter-focus"],
        "keyTerms": ["课程覆盖情况", "课程体系短板"],
        "evidenceIds": [],
        "styleRuleIds": [],
        "verification": {
          "fullContextChecked": true,
          "counterEvidenceChecked": true,
          "result": "supported",
          "documentEvidenceExcerpt": "课程覆盖情况在本节前文已经说明",
          "relatedExcerpts": ["本节已完成课程覆盖现状分析。"]
        }
      }
    }
  ]
}
